,date,star,doc
3346,2020-12-08,4,복분자주는 무겁고 드라이한데 빙탄복은 가볍고 시원해요 맥주하고 와인의 장점을 결합한 느낌또주문합니다
3347,2020-12-08,5,술집에서 마셔보고 맛있어서 시켰어요 향이 좋아서 그런지 샴페인잔에 따라 마심 좋을듯
3348,2021-01-09,5,달콤하고 향도 좋아요 정말 맛있어요
3349,2020-12-19,4,배송을 꼼꼼하게 잘해서 보내주고 배송이 빨랐어요
3350,2021-01-16,5,목넘김은 좋고 맛있어요
3351,2020-12-24,5,첫잔 와인잔에 따라 마시니 다소 밍밍한 맛에 살짝 실망연달아 두번째잔은 보내준 빨대꽂아 마시니 좀 더 깊은맛이 나네요탄산음료같은 느낌이었는데 두병마시니 취기가 슬슬 올라옵니다
3352,2021-01-22,5,매번마시는그맛
3353,2021-01-08,5,너무맛있어서 음료처럼 먹게됩니다번창하세요
3354,2021-01-04,4,술을 잘 못먹는데 독하지 않아서 좋았어요다음에 또 시킬께요
3355,2020-12-16,5,배송도 빠르고무엇보다 깨지지않게 포장이 너무 잘되어있어요
3356,2021-01-07,5,맛있어요 배송시 깨져서 다시 배달해주셨어요
3357,2021-01-13,5,맛있는 술로 가족 대화에 도움
3358,2021-01-12,5,너무 맛있어요자주마실듯요
3359,2021-01-06,5,다른 복분자는 못먹겠어요청량감과 당도가 매매우 훌륭합니다
3360,2021-01-12,5,맛있어서 추가 구매합니다 인 병 해야겠어요 
3361,2020-12-22,5,너무 맛있어서 금방 다 마셔버렸습니다
3362,2020-12-23,5,예전에먹고 반해버린술 까자마자 세병마셨어요
3363,2021-01-06,5,일반박스에왓는데 열어보니 포장굿맛도아주좋아요
3364,2021-01-22,5,역시 좋습니다
3365,2021-01-08,4,리뷰보고시켰어요맛보고다시올 릴께요
3366,2020-12-23,5,부담없이 시원하게 마시는 스파클링 복분자 와인
3367,2020-12-18,5,세번째 시켜요 혼술 원픽 코로나를 잘 이겨봅시다
3368,2020-12-30,5,한달사용리뷰인데 마침 어제 마지막한병을 먹었습니다 식전주 식후주로 얼음 타서 먹으면 참 맛있어요
3369,2021-01-13,5,달달한 스파클링 주류중 괜찮은 상품입니다
3370,2020-12-18,5,음료수같아요 얼음 타먹으면 굿
3371,2020-12-09,5,부드럽고 맛있어요포장도 꼼꼼하고 가성비 좋은 와인이네요
3372,2020-12-20,5,너무 맛있어서 주기적으로 주문하고 있습니다
3373,2021-01-15,5,복분자 음료 같아요 맛있어요
3374,2020-12-19,5,예전에먹고 진짜 그리워서 찾았는데 인터넷에파니 너무좋아요 
3375,2021-01-20,5, 병 샀는데 그날 다 마심
3376,2021-01-15,5,두번째 구매 맛있어요 
3377,2021-01-15,5,잘포장되서좋아용굿굿
3378,2020-12-27,5,이거 벌써 여러 번 시키네요
3379,2021-01-11,5,맛있어요 다마셔서 재구매합니다
3380,2020-12-23,5,도수가 높지않아서 알쓰도 즐길수있어요
3381,2020-11-26,5,빠른 배송 좋았습니다 포장 상태도 깨끗하고 안에도 병이 깨지지 않게 잘 왔습니다 감사합니다
3382,2020-12-19,5,오 완전조아영더 사고프네야
3383,2020-12-23,5,적당한 스파클링 적당한 맛 굿 밸런스
3384,2021-01-16,5,한달사용기는 좀 하루만에 
3385,2021-01-16,5,좋은 상품 구매했어요
3386,2020-12-28,5,포장 꼼꼼하게 잘왔습니다 맛도 최고예요
3387,2020-12-18,5,탄산이 있지만 어느 정도 적당한 탄산이라서 목넘김에 부담이 없어요복분자주를 처음 마셔보는데 맛있네요다음에 또 구매하려구요회사로 시켜서 병씩 나눴어요 
3388,2020-12-27,5,가볍게 마시기딱 좋습니다
3389,2020-12-19,5,정말맘에들어요감사합니다
3390,2021-01-19,5,자알받았습니다
3391,2020-12-13,5,도수가 높지 않아서 주말에 가족과 가볍게 맛있는 음식과 곁들이기 아주 좋아요
3392,2020-12-14,5,드디어 사먹어봤어요 입맛 까다로운 남편도 발포주라 술술 잘 마시네요
3393,2020-12-16,4,다른술은 잘 못먹는데 너무 음료수같이 맛잇어서 종종 구매합니다 
3394,2021-02-04,5,너무너무 맛있어요
3395,2020-12-24,5,적당히달고적당히스파클링잇고 굿이에요
3396,2021-01-01,5,독하지도 않고 맛있다고 하네요또 담에 주문하려구요포장도 잘 되어서왔어요
3397,2020-12-08,5,지인의 추천으로 구입했어요 맛이 기대되네요
3398,2020-12-07,5,와인같으면서 톡톡쏘는게 너무달지도않고 밤에 홀짝홀짝먹기 너무 좋습니다 장모님도 시켜드렸는데 너무 좋아하시네요 포장 꼼꼼한데 저는 올때 한번 파손이 되긴했지만 다행히 잘 처리해주셔서 하루걸러 바로받았습니다 다먹으면 재구매 바로해야겠습니다 
3399,2020-12-17,5,포장도 잘되어서 오고 좋습니다 맛이야 먹어봐서 알구요
3400,2020-12-30,5,아직 먹어보진않앗지만 포장꼼꼼히 잘받앗습니다 낼 마셔볼 예정이랍니다 
3401,2020-12-05,5,비싼 샴페인보다 남편이 더 좋아해요 올해는 연말 모임 없을꺼라 생각하고 더 샀는데 각 병씩 먹으니깐 담엔 더 많이사야겠어요
3402,2021-01-14,5,얼음 개 타서 먹으면 넘나맛있는것
3403,2020-12-08,5,적당하게 달고 적당하게 맛있어요 즐거운 시간 잘 보낼께요 잘 받았습니다
3404,2021-01-08,5,연초라 늦께 올줄 알았는데 배송 빠르네요
3405,2020-12-23,4,빙탄복은 재구매입니다 가격도 착하고너무맛있어요 배송도 적당하구요 먹고 또주문할꺼에요
3406,2020-12-17,5,진짜 너무맛잇어요 젤 좋아하는술이예요
3407,2021-01-06,5,역시 연말엔 빙탄복이네요 맛있어요
3408,2021-01-11,5,탄산복분자 너무 맛있어요
3409,2020-12-14,3,일반 스파클링 화이트 와인처럼 달달한 맛이 있을줄 알았는데 복분자주에 단맛 전혀없는 맛이라 저는 단독으로 마시기에는 별로 맛이 없네요 알코올 도수는 그렇게 높지않아 레몬과일청 넣으니 색깔 엄청 예뻐서 레몬청 넣고 마시기로 했어요
3410,2020-11-30,5,독채펜션에 여행갈때 사서 갔는데처음 마셔본 친구가 반해버렸어요요즘 빙탄복을 함께 마시는각자 집에서 친구들이 늘어서 넘 좋습니다
3411,2020-12-03,5,홈파티 여행갈때 등 항상주문해요 다들 호불호안갈리고 좋아하더라구요
3412,2020-12-21,4,빨대가 병 밑까지 닿아서 쭉 마시기 좋습니다
3413,2021-01-11,5,배송 상품 모두 만족합니다
3414,2021-01-13,5,톡쏘는맛이 좋네요
3415,2020-12-17,5,얼음넣은거보다 빨대 꽂아 마시는게 더 좋았어요
3416,2021-01-09,4,맛은있는데 약간탄산이적은느낌
3417,2020-12-09,5,맛있어요술 잘못마시는 친구도 맛있다며 좋아하네요
3418,2021-01-07,5,마시다 보면 훅 갈꺼 같은 술이에요 맛있습니다
3419,2020-12-19,5,포장도 꼼꼼하고 목넘김도 좋아요
3420,2020-12-29,5,맛있어요 매일먹어서 이틀에한박스시키는거같은데택배아저씨가 놀란거같아요
3421,2020-12-21,5,한번 구매한 후로 여기저기 선물도 하고 있어요 맥주 대신 할수 있을정도로 적당한 도수에 분위기 있게 마실수 있어서 만족합니다
3422,2020-12-25,5,다른 후기처럼 빨대는 빼고 주셔도 좋을 것 같아요 와인 좋아하는데 스파클링이고 적당히 달아서 넘 맛있게 먹었어요
3423,2020-12-22,5,와이프가 맛잇어 해서 한번더 구매
3424,2021-01-02,5,세상 이런 복분자는 처음 맛있어요 재구매해야지요
3425,2021-01-06,5,맛있네요 한병 순삭이에요
3426,2020-12-14,5,맛나요 술 인터넷으로 첨 사보는데 또 살거 같아요 
3427,2020-12-29,5,맛나요 크리스마스 전에 주문매진이라 당황했지만 연말엔 마실수 있겠네요
3428,2020-12-16,5,술못하는저도 너무 맛나요
3429,2020-12-14,5,맥주는배부르고 소주는 강해서 선택했는데 맛있고 고기랑도 잘어울려요
3430,2021-01-17,4,너무 맛있어요
3431,2020-12-21,5,궁금해서 시켜봣는데 고기먹을때 궁합이 좋네요 다음에 먹고싶을때 또 시킬게요
3432,2021-01-10,4,생각보다 도수는 높네요
3433,2021-01-09,5, 일 저녁에 마시고 싶엇눈데낮에 딱 배달만족합니당
3434,2020-12-26,5,도착한지 얼마안되어서 바로 다 먹어버렸네요너무 맛있어서 다음에 또 시켜야겠어요
3435,2020-12-09,5,가볍게 마시기 좋아요 선물용으로도 좋습니다
3436,2021-01-13,5,이거 맛있어요 또 시켰어요
3437,2021-01-06,5,집에서 배달시켜서 먹을수 있다는게 참 좋아요
3438,2021-01-02,5,너무 맛있어요 도수가 세지않아서 부담없이 마시기 좋네요 
3439,2021-01-09,5,음료수입니다 맛나게 먹을께요
3440,2020-12-27,5,진짜진짜 맛있어요 인터넷으로 믿고 구매할수있으니 더편리하고 좋네요 종종 구입하게될것같아요 
3441,2021-01-07,5,맛이좋아요 인기있는이유있네요
3442,2020-12-15,5,배송 정말 빠르고 파손되지 않게 꼼꼼히 보내주셔서 좋습니다 
3443,2020-12-23,5,빨대는 필요없는데 자꾸주심
3444,2020-12-15,5,맛있고 어르신들도 너무좋아하세요
3445,2021-01-07,5,친구가 강추해서 사봤는데 넘 맛있어요
3446,2020-12-12,5,맛있어요 굿굿굿빨대로먹으니 취하네용
3447,2021-01-20,4,맛잇어요
3448,2021-01-05,5,너무맛잇어요오 다먹고또시킬께용
3449,2021-01-13,5,맛있어요 또 시킬게요
3450,2021-01-02,5,우리 식구들이 재구매 요청하네요모두 대만족기분좋게 먹었습니다
3451,2020-12-15,5,가볍게 마시기 좋은 맛있는 술이예요완전 강추
3452,2020-12-10,5,일단 배송중 깨지지 않게 잘 포장돼서 왔다는 점에서 좋았습니다 술의 맛은 스파클링 와인에 복분자의 맛이 나는 느낌이었고요 탄산은 강하지 않았으며 단맛이 너무 강하지않아 음료수같지는 않았어요 식전음료나 웰컴드링크로 마시지 좋을 것 같아요
3453,2021-01-10,2,너무 단맛이 강합니다
3454,2020-12-12,5,빠른배송 좋아요 맛있을거 같아요
3455,2020-12-10,5,전에 선물받고 맛있어서 주문해봤어요 맛나용
3456,2021-01-04,5,세번째 주문요말이 필요없지요
3457,2020-12-16,5,맛이있습니다 혼술하기 딱 좋은술 같습니다
3458,2020-12-25,5,맛있네요아는 지인에게 병줬더니 맛있다고하네요적당하게 달고 가볍게 먹기좋네요
3459,2021-01-08,5,맛있어서항상 사먹고있습니다
3460,2020-12-13,5,맛있어요 짱 맛있어요 탄산이 보글보글
3461,2020-12-19,5,차게 마시면 더 맛있어요
3462,2020-12-20,5,소주만 마시던 신랑도 갈아탔어요
3463,2020-12-17,5,몇번이나 시켜도 너무 맛있어요
3464,2020-12-31,5,유명해서 구입했는데 배송도 빠르고 마지막날 짠할수있게 되서 기뻐요
3465,2020-11-19,5,얼음을 넣어 마심 너무너무 맛있는 빙탄복주변에 파는 곳이 잘 없어서인터넷으로 구매했는데 잘 도착했습니다냉장고에 쟁여두고 캠핑갈 때마다 하나씩 챙겨가려고 합니다 달달하니 안주를 부르는 술입니다
3466,2020-12-09,5,스파클링와인 좋아한다면 강추해요맛있어요
3467,2020-12-19,5,동생이 시켜서 이번에 제가 시킵니다
3468,2020-12-15,5,맛있어서 또 주문했습니다
3469,2021-01-09,5,진짜 너무너무너무 맛있어서 병 순삭
3470,2020-12-14,5,넘나맛있어서 또 주문했어요
3471,2021-01-09,5,상품배송 만족합니다
3472,2021-01-03,5,재구매입니다 식사와 같이하기에 너무 좋아요
3473,2021-01-02,5,포장정말꼼꼼하고 달달한맛이좋아요
3474,2021-01-07,5,넘 맛있고 좋아요
3475,2021-01-04,5,맛있어요재구매합니다
3476,2020-12-10,5,넘맛있어요 담에 또 주문할게요
3477,2020-12-02,3,소주도 좋아하고 와인도 좋하는 사람으로써 그 중간이라고 생각하면 좋을것 같아요소주를 마시고 싶으면 소주를 마시고 와인을 먹을꺼면 와인을 먹는게 나을것 같습니다 
3478,2020-12-03,3,예전부터어떤맛일지너무궁금해서이번에주문했는데배송빠르고포장도잘되서왔어요오자마자마셨는데달지않고약한탄산에편하게마시기괜찮아요반주하려했는데한병다마셨어요음료느낌살짝있어 오히려갈증날때맥주보다얼음넣고마시면배부르지않고좋을듯
3479,2021-01-06,5,재구매 번째입니다 너무 맛나요
3480,2021-01-01,5,아주 맛나요빨대 꽂아서 먹기도 괜찮아요
3481,2020-12-01,5,우와 배송도 정말 빠르고 꼼꼼하게 포장되어 잘 왔어요 여자들이 딱 좋아할 맛이네요
3482,2021-01-02,4,복분자치곤 연한데 와인과비슷하니 먹기좋네요
3483,2021-01-07,5,넘 맛있어서 자주 사요
3484,2021-01-03,5,배송이 하루 늦었지만 역시 빙탄복 맛있네요 
3485,2020-11-27,5,맛있어요 시원하게 마시니 더 맛있네요 택배도 꼼꼼히 오고 맛도배송도 다만족입니다
3486,2021-01-08,5,빨대로 편하게 마시는 복분자
3487,2021-01-02,3,가볍고 향긋한 술을 좋아하는 분께는 추천소주를 좋아하는 분께는 비추
3488,2020-12-17,5,감사합니다 잘 먹겠습니다
3489,2020-12-02,5,친구들과 마시려고 시켰는데 받고나서 바로 맛을 봐야겠다는 생각에 역시나 굿굿입니다
3490,2020-12-11,5,어제받아서 첫 시식했어요연말에 가볍게 긋
3491,2021-01-07,5,없음 허전해서 자주 주문해놔요
3492,2021-01-04,5,와인 같은거 잘 못먹는데 맛있네요
3493,2020-12-14,5,맛도 괜찮고 배송도 꼼꼼해요
3494,2020-12-28,5,아주 맛잇게 잘 먹고있습니다다음에 또 시켜먹을려구요
3495,2021-02-04,5,빙탄복 
3496,2020-12-28,5,빙탄복 제일맛있어요 대량으로사놓고싶다
3497,2020-12-13,5,너무맛있어요좋아용
3498,2020-12-09,5,많이 달지도 않고 탄산도 있어서 복분자스파클링와인처럼 맛있었어요
3499,2020-12-20,5,친구한테 선물했어요 배송도 빨리해주시고 감사합니다
3500,2021-01-07,5,복분자 맛이 좀 덜 느껴집니다
3501,2021-01-01,5,제입맛에 딱이에요스파클링도 좋고 달달하니 술술넘어가요
3502,2020-12-16,4,빙탄복은 맛은 복분자 원액에 사이다를 혼합한 맛
3503,2021-01-02,5,스파클링 와인이라 달달하고 좋습니다
3504,2021-01-02,5,재구매 선물로 보냈는데 만족하다네요
3505,2020-12-16,4,배송도빠르고 맛있었여 
3506,2020-12-08,5,포장 너무 꼼꼼히 해주셔서 감동아직 시음전인데 후기 믿고 구매했어요 
3507,2020-12-08,5,항상 구매함용량쫌 커지고 쬐매저렴해지면 좋겠당
3508,2020-12-21,4,많이 달아요
3509,2020-12-25,5,맛있어요시원한 목 넘김이 아주 좋답니다또 구입할께요
3510,2020-12-03,5,복분자 스파클링 맛있어요 생각나서 또 샀습니다 
3511,2021-01-02,5,맛이 있어서 좋습니다
3512,2020-11-25,5,빙탄복을 신사동 회장님댁에서 먹어보고 완전 매력에 빠져서 혼술 할때 먹으려고 샀어요 여성분들께는 취향 저격입니다앙
3513,2021-01-06,5,너무 맛있는데 훅 가요 
3514,2020-12-13,5,부모님이 부담없이 마시기 좋다고 하시네요
3515,2020-12-12,4,친구들과 캐주얼하게 마시기 좋은 복분자 탄산음료 알코올은 거의 느껴지지 않고 탄산음료인데 끝맛에 달큰 향기로운 복분자맛이 느껴져서 기분좋음 즐거운 연말파티 음료로도 가볍게 하기 좋을듯
3516,2020-12-07,4,맛은 생각보다 달지 않아요 얼음과 같이 먹으면 맛있다고 하는데 저는 오히려 얼음 안 넣고 먹는게 나은거 같아요 탄산도 쎄지않아서 오히려 좋았어요 알쓰분들은 맛있게 잘 드실꺼같아요
3517,2020-12-29,5,또 시켰어요요새술이늘었다고 남편이 칭찬하네요
3518,2020-12-11,5,맛있고 포장도 잘되어있어요
3519,2020-12-21,5,달콤하고 부담없어 좋아요얼음 넣어 짠 두 번째 구매합니다
3520,2020-12-30,4,맛있게 먹었습니다 시원하게먹으면 음료수같네요
3521,2020-12-22,5,오랜만에 생각나서 구입했어요역시 달달하니 맛있네요
3522,2021-01-01,5,너무맛있고 좋았어요
3523,2020-12-18,5,도수가 낮아서 부모님이랑 먹기가 좋았구 얼음 넣어서 먹으며 훨씬더 좋아요 간단하게 혼술하는것도 추천
3524,2020-12-18,5,주점에서 먹었던 술이라 가이트에서 보고 바로 주문했습니다 포장도 꼼꼼하게 잘되어서 왔네요 좋습니다
3525,2020-12-11,3,아직 맛을 보지 못했지만 겉모양만 보아도 기대됩니다
3526,2020-12-17,5,시음전포장상태 굿
3527,2020-12-09,5,맛이 좋아 개인적으로 자주 시켜먹지만 지인 선물용으로 보냈는데 엄청좋아하네요 도수도 낮고 맛도 달달한 복분자맛에 스파클링이라서 고기먹을때 아주 좋아요
3528,2020-12-20,5,술을 못하는 사람에게 어울리는 술이에요 포장도 꼼꼼해서 더 좋았어요
3529,2020-12-27,4,좋아요 담에 또구매할께요
3530,2020-12-21,4,배송도빠르고 좋아요 가격대비 좋아요
3531,2020-12-15,5,부담없이마시기 아주좋아요 빨대도 같이동봉되어있어서 인 병하기도 좋습니다 코로나때문에 답답한마음이 조금은 풀리는듯하네요
3532,2020-12-12,5,완전 만족 두박스째 주문 합니다
3533,2020-12-02,5,포장 잘왔고 빨대 귀엽네요 음료 처럼 잘 마실게여
3534,2020-12-08,5,오 맛도 좋고 탄산도 가볍게 있어서 맘에 들어요
3535,2020-12-29,5,감사해요 선물용이에요
3536,2021-01-04,5,휴 술 끊었었는데 이거땜에 시키고 또시키고 맛있다
3537,2020-12-09,5,아직 먹어보지는 않았지만 느낌이 좋습니다
3538,2020-12-12,5,아직안먹었지만 맛있다고 들어 구매합니다
3539,2021-01-03,5,진짜 맛있는거 같아요
3540,2020-12-25,5,역시 맛나용 넘맛나서 늘상 과음 
3541,2020-11-30,5,요즘 최애술 주변에 선물도 하고함께 빙탄복에 빠져사는 요즘입니다연말에 집에서 가족과 함께 즐겨보세요
3542,2021-01-02,3,조금 덜 달았으면 더 맛있을것 같습니다
3543,2020-12-30,5,맛있어요 자주주문할것 같아요
3544,2020-12-30,4,포장도 넘 꼼꼼하게 잘와서 좋았어요
3545,2020-12-13,5,너무 맛있어서 또 샀어요
3546,2021-01-23,5,맛있어요 좋아요 
3547,2020-11-24,5,요즘 술이고파 한박스 주문했어요 온라인 상으로 술이 배달되니 좋네요
3548,2020-12-05,5,지인이 추천해서 주문했는데 아주 맛있네요
3549,2020-10-28,1,술집에서 먹어보고 맛있어서 인터넷으로 당장주문한건데받고 너무실망했내요 이번주 가족모임있어서 가져간다고해놨는데배송이게 뭐죠 상자보고 아 이거아닌데 했는데 까보니 역시나안에 깨진거 상태 장난이아니네요
3550,2020-12-31,5,이정도면 뭐 맛있는 술이지요
3551,2020-12-23,5,여자분들 취향에 딱 일거예요가볍게 한잔하기 좋아요
3552,2020-11-19,4,처음엔 이게 무슨 맛인가 했었는데요 요개요개 마실수록 더 맛이 좋은데요 그리고 뚜껑을 오픈하고 천천히 마시니 더 맛이 좋은 것 같아요 안주 없이도 마시기 편안합니다
3553,2020-12-23,5,맛이 아주 좋아 마음에 들었어요 자주 찾을 거 같네요
3554,2020-12-04,5,벌써 몇번째 주문인지 맛있어서 자꾸 구매합니다
3555,2020-12-26,3,스파클링이래서 기대하고 샀는데 보통 술들이랑 비슷하네요 
3556,2021-01-03,5,신랑이랑 반주하기에 좋은 술
3557,2020-11-30,5,복분자향이 진하면서 은은하게 입속에 남아요달콤하고 부드러워 맛있어요
3558,2020-12-07,5,맛있어요 고기랑같이드세요
3559,2020-12-23,5,편의점에서 자주 사먹다가 인터넷으로 시켰는데 편하게 먹을 수 있어 좋아요
3560,2021-01-02,5,좋아요 좋아요
3561,2020-12-27,5,재구매예요맛있어서 주변 사람들한테 추천했어요
3562,2020-12-10,5,아직먹어보기 전이지만 너무 기대됩니당
3563,2021-01-01,5,달달하고 너무 맛있어여
3564,2021-01-17,5,배송 빠르고 좋아요좋아요
3565,2020-12-29,5,하염없이 들어가는맛몇박스 주문해야할것같아요
3566,2020-12-11,5,배송빨라요 좋아요에
3567,2020-12-03,5,맛있네요 상품평이좋아샀어요
3568,2021-01-20,5,만족합니다 만족합니다
3569,2020-12-29,5,술이 약한 사람들이 즐기기에 너무 좋은 술이에요
3570,2020-11-30,5,달지 않은 복분자 주에 탄산이 가미되어 술을 잘 즐기지 못해도 맛있게 마실 수 있더군요
3571,2020-12-25,5,조아요 두번째 구매입니다
3572,2021-01-12,5,좋아요 좋아요 좋아요 좋아요 좋아요 좋아요
3573,2020-12-17,3,아직개몽은안했지만포장상태는괜찮아요술못하는신랑을위해주문했는데기대되요 
3574,2020-12-08,5,매번 잘먹고있어요 재구매할거에요
3575,2020-12-08,5,아껴먹을 수 없는 맛있는 맛친구들과 함께 마시려고 한번 주문하고이번엔 집에서 마시고 싶을 때 마다 마시려고 주문했어요 달달한 맛 덕분에 와인보다 좋아하는 술이 되었어요
3576,2020-12-15,5,사러 안가도 되고 집에서 받으니 너무 좋네요 포장도 너무 깔끔해요
3577,2020-12-23,5,생각 보다 알콜향이 느껴지는데 그래도 맛있네요
3578,2020-12-04,4,복분자주 좋아하는데 가볍게 마시기 좋습니다 한병 먹으려니 약해서 두병째 마시네요
3579,2020-12-18,5,자주먹던와인맛이랑같아요 가격저렴하고 좋아요
3580,2020-11-26,5,리뷰보고 주문해서 마셔보았는데요 진짜 맛있어요 탄산이 들어가 홀짝홀짝 잘들어가네요
3581,2020-12-06,5,배송도 빨랐고 완전 맛있어요
3582,2020-12-23,5,완전대만족 재구매 완전최고와인
3583,2020-12-31,5,상품 배송 만족합니다
3584,2020-12-29,5,가족 모두가 만족하는 복분자와인입니다
3585,2020-12-15,5, 번째구매 번째까지 찍어 올께요
3586,2020-12-10,5,부모님 선물로 드렸습니다
3587,2020-12-08,4,깔끔하니 좋아요 잘 마십니다
3588,2021-01-02,5,독하지 않고 좋습니다
3589,2020-12-22,4,간편히 먹을 수 있는 복분자 와인입니다 한 병에 정도로 양도 적당합니다
3590,2020-12-27,5,토닉워터랑 먹으니까 더 맛있어요
3591,2020-12-14,4,생각보다 안달고 포장 단단히 받았네요 옛추억이 있는술이라 좋았어요
3592,2020-11-28,5,맛있어요 잘 마셨어요 배송도 하루만에 받았어요
3593,2020-12-04,5,아직 안마셔봤지만 깨진거 없이 잘받았어요
3594,2020-11-17,5,너무 맛있어서 놀랐어요 도수에 비해 알콜 쓴맛이 거의 느껴지지 않아서 먹다가 훅 갈것같은 느낌이에요 재주문 할거에요
3595,2020-12-08,5,맛있다는 후기 보고 구입했는데 배송도 빠르고 받자 마자 마셔봤는데 맛있네요적당한 탄산에 너무 달지도 않고 계속 마시게 되네요
3596,2020-12-26,5,정기적으로 주문해서 마시고 있는 매우 좋은 우리 술
3597,2020-12-04,5,재구매성공선물로 줬는데 아주 좋다고 하네요
3598,2020-12-19,3,화이트 와인처럼달콤하고 스파클링이 있어서식전주나 디저트로 먹기 좋아요마냥 마시기에는 너무 단감이 있긴하네요
3599,2020-12-24,5,개인적으로 비슷한 다른 술보다 더 맛있었어요
3600,2020-12-31,5,역시 배상면주가입니다
3601,2020-12-11,5,잘 도착했습니다
3602,2020-12-29,5,빙탄복 최고에요 인생주
3603,2020-12-06,5,너무 맛있어서 세번째 재구매해요
3604,2020-12-29,5,스파클링도 적당하고 좋습니다
3605,2020-12-15,5,깨질까봐 걱정했는데 포장을 꼼꼼하게 해주셔서 잘 도착했어요
3606,2020-11-29,5,배달은 좀 느렸지만포장완벽했고 맛도 좋고재구매 합니다
3607,2020-12-15,5,탄산도 적당하고 약간 달달한 맛으로 분위기 내기 좋아요 알콜도수는 꽤 되네요
3608,2020-12-17,5,평소 술을 별로 안좋아하는데 달고 맛있어용 파티용으로 딱이에요
3609,2020-12-14,5,맛있어요 병이 너무 예뻐서 기분전환 굿
3610,2020-12-27,5,술이 달달하게 맛있어요
3611,2020-12-03,5,맛있어요향도 좋구요
3612,2020-12-23,5,스파클링와인처럼 가볍게 분위기내기 괜찮아요
3613,2020-12-07,4,포장 잘 되어서 왔어요
3614,2020-12-17,5,맛있어요스파쿨링이라 복분자주보다더 시원하고술술들어가요
3615,2020-12-14,5,벌써 번째 구매하고있어요 도수도 높지않고 가볒게한잔하기좋은 다음날 숙취도없네요 포장도 어찌나 꼼꼼한지 계속 구매하려구요
3616,2020-12-22,5,그냥 매장가서 먹능거에 비해 싸서 삿는데 쫌 아쉽네요
3617,2020-11-26,5,아직 먹기전이고 선물용으로샀어요 후기보니 기대되네요
3618,2020-12-19,4,술을 잘 못마시는 가족들과 함께 저녁에 한잔씩 먹으니 맛나고 좋네요
3619,2020-12-28,5,언제 마셔도 시원하고 달달해요
3620,2020-12-30,5,알쓰인 저한테 딱 좋네요
3621,2020-12-20,5,자주 시켜먹는 곳이에요 선물용으로도 좋아요
3622,2020-12-26,5,와인보다 좋은것 같아요
3623,2020-12-20,5,꼼꼼하게 포장되어서 왔어요 맛도 좋으네요
3624,2020-12-29,5,가볍게 마시기 좋은 술
3625,2020-12-29,5,엄마사드렸어요 맛있다하시네요
